{
  "$schema": "https://json-schema.org/draft/2020-12/schema",
  "$id": "https://github.com/veeresh-bikkaneti/airlock/tools/3d-system-visualizer/scenes/schema.json",
  "title": "Airlock 3D system visualizer scene",
  "description": "A scene describes a system as a node graph plus one or more animated flows through it. The renderer (tools/3d-system-visualizer/index.html) consumes this shape directly. Authors write scenes; nobody writes animation code. See ADR-010.",
  "type": "object",
  "required": ["nodes", "edges"],
  "additionalProperties": false,
  "properties": {
    "title": {
      "type": "string",
      "description": "Display title for the scene. Shown in the scene panel.",
      "maxLength": 80
    },
    "description": {
      "type": "string",
      "description": "One or two sentences on what this scene shows and who it is for.",
      "maxLength": 400
    },
    "nodes": {
      "type": "array",
      "minItems": 2,
      "maxItems": 40,
      "items": { "$ref": "#/$defs/node" },
      "description": "Boxes in the scene. Above roughly 20 the graph stops being readable — split into two scenes instead."
    },
    "edges": {
      "type": "array",
      "minItems": 1,
      "items": { "$ref": "#/$defs/edge" },
      "description": "Connectors between nodes. Every from/to must name an existing node id."
    },
    "flows": {
      "type": "array",
      "items": { "$ref": "#/$defs/flow" },
      "description": "Animated walks through the graph. Each consecutive pair in a flow's path must have a matching edge."
    }
  },
  "$defs": {
    "node": {
      "type": "object",
      "required": ["id", "label", "pos"],
      "additionalProperties": false,
      "properties": {
        "id": {
          "type": "string",
          "pattern": "^[a-z0-9_]+$",
          "description": "Unique within the scene. Lowercase, digits, underscores. Referenced by edges and flow paths."
        },
        "label": {
          "type": "string",
          "maxLength": 28,
          "description": "Text drawn on the box. Keep it short — long labels overflow the box face."
        },
        "pos": {
          "type": "array",
          "items": { "type": "number" },
          "minItems": 3,
          "maxItems": 3,
          "description": "[x, y, z] in scene units. Convention: x increases left-to-right along the main flow, y stacks layers (0 = primary path, +3 = supporting services, -3 = datastores), z separates parallel branches. Keep neighbours at least 3 units apart or boxes collide."
        },
        "type": {
          "enum": ["service", "datastore", "infra", "external", "user"],
          "default": "service",
          "description": "Drives box colour and shape. 'external' = outside your trust boundary; 'user' = a human."
        },
        "description": { "type": "string", "maxLength": 300, "description": "Shown in the inspect panel when the node is clicked." },
        "owner": { "type": "string", "maxLength": 60 },
        "status": {
          "enum": ["healthy", "degraded", "down"],
          "default": "healthy",
          "description": "'degraded' glows amber, 'down' glows red, so problems read without clicking."
        }
      }
    },
    "edge": {
      "type": "object",
      "required": ["from", "to"],
      "additionalProperties": false,
      "properties": {
        "from": { "type": "string", "pattern": "^[a-z0-9_]+$" },
        "to": { "type": "string", "pattern": "^[a-z0-9_]+$" },
        "label": { "type": "string", "maxLength": 32, "description": "What travels along this edge, as a verb phrase: 'reserve stock', 'verify token'." },
        "protocol": { "type": "string", "maxLength": 24 },
        "latencyMs": {
          "type": "number",
          "minimum": 0,
          "description": "Colours the flow trail cool-to-warm. Omit when unknown — do not invent numbers."
        }
      }
    },
    "flow": {
      "type": "object",
      "required": ["name", "path"],
      "additionalProperties": false,
      "properties": {
        "name": { "type": "string", "maxLength": 60 },
        "path": {
          "type": "array",
          "minItems": 2,
          "items": { "type": "string", "pattern": "^[a-z0-9_]+$" },
          "description": "Ordered node ids. A node may repeat (out-and-back through a gateway is normal)."
        },
        "steps": {
          "type": "array",
          "items": { "$ref": "#/$defs/step" },
          "description": "Optional narration, one entry per HOP. A path of N nodes has N-1 hops, so steps must have length N-1 when present. This is what turns an animation into an explanation."
        },
        "mode": {
          "enum": ["auto", "guided"],
          "default": "auto",
          "description": "'auto' loops continuously (the original behaviour). 'guided' pauses at each hop and shows the caption with next/previous controls — use it for teaching scenes."
        },
        "loop": { "type": "boolean", "default": true },
        "speed": { "type": "number", "exclusiveMinimum": 0, "maximum": 10, "default": 3 },
        "provider": {
          "type": "string",
          "maxLength": 32,
          "description": "Emitted by Generate-LiveScene.ps1 on scenes built from the audit log: which backend the recorded action used. Not hand-authored."
        },
        "outcome": {
          "type": "string",
          "maxLength": 32,
          "description": "Emitted by Generate-LiveScene.ps1: the recorded result (SUCCESS, WARNING, FAILED). Not hand-authored."
        }
      }
    },
    "step": {
      "type": "object",
      "required": ["caption"],
      "additionalProperties": false,
      "properties": {
        "caption": {
          "type": "string",
          "maxLength": 90,
          "description": "One sentence, second person, present tense, no unexplained jargon. This is the line a beginner reads."
        },
        "detail": {
          "type": "string",
          "maxLength": 300,
          "description": "Optional second line for the reader who wants the why. Safe to skip."
        }
      }
    }
  }
}
