{
  "title": "Airlock: your first run",
  "description": "What actually happens when you type ai-start, in nine steps. Written for someone who has never run a local model before.",
  "nodes": [
    { "id": "you",        "label": "You",              "pos": [-12, 0, 0],  "type": "user",
      "description": "One command. You do not need to know which port, which model, or which backend." },
    { "id": "start_ai",   "label": "ai-start",          "pos": [-8, 0, 0],   "type": "service",
      "description": "Start-AI.ps1 — the front door. Decides the backend, enforces single-instance, binds the port, guards the firewall." },
    { "id": "policy",     "label": "provider-policy",   "pos": [-8, 3, -3],  "type": "datastore",
      "description": "Your saved intent: which backend you prefer, whether cloud fallback is allowed at all." },
    { "id": "capability", "label": "capability check",  "pos": [-4, 3, -3],  "type": "service",
      "description": "Get-BackendCapability.ps1 — is vLLM even possible here? Needs an NVIDIA GPU and Docker running." },
    { "id": "acquire",    "label": "model picker",      "pos": [-4, -3, -3], "type": "service",
      "description": "Get-ModelAcquisition.ps1 — sizes candidate models against FREE VRAM, not system RAM (ADR-005), and pulls one if you have none." },
    { "id": "backend",    "label": "Ollama",            "pos": [0, 0, 0],    "type": "service",
      "description": "The local inference engine. One instance, always — never two competing for the same GPU." },
    { "id": "firewall",   "label": "firewall guard",    "pos": [0, 3, 3],    "type": "infra",
      "description": "Blocks inbound on the port. Defence in depth: the listener is loopback-only regardless." },
    { "id": "endpoint",   "label": "127.0.0.1:12345",   "pos": [4, 0, 0],    "type": "infra",
      "description": "One stable address. Every tool you point here keeps working when the model behind it changes." },
    { "id": "audit",      "label": "audit log",         "pos": [4, -3, -3],  "type": "datastore",
      "description": "Every state change, timestamped. This is also what Generate-LiveScene.ps1 turns back into a scene." },
    { "id": "tools",      "label": "your AI tools",     "pos": [8, 0, 0],    "type": "external",
      "description": "aider, Claude Code, opencode, Codex — all pointed at the same endpoint." }
  ],
  "edges": [
    { "from": "you",        "to": "start_ai",   "label": "ai-start" },
    { "from": "start_ai",   "to": "policy",     "label": "read intent" },
    { "from": "policy",     "to": "capability", "label": "vLLM possible?" },
    { "from": "capability", "to": "acquire",    "label": "pick a model" },
    { "from": "acquire",    "to": "backend",    "label": "launch" },
    { "from": "backend",    "to": "firewall",   "label": "guard port" },
    { "from": "firewall",   "to": "endpoint",   "label": "bind loopback" },
    { "from": "endpoint",   "to": "audit",      "label": "log READY" },
    { "from": "audit",      "to": "tools",      "label": "you're live" },
    { "from": "tools",      "to": "endpoint",   "label": "requests", "protocol": "HTTP", "latencyMs": 12 }
  ],
  "flows": [
    {
      "name": "First run: what ai-start does",
      "mode": "guided",
      "loop": false,
      "speed": 2,
      "path": ["you", "start_ai", "policy", "capability", "acquire", "backend", "firewall", "endpoint", "audit", "tools"],
      "steps": [
        { "caption": "You type ai-start. That is the whole command.",
          "detail": "No port to choose, no model name to memorise, no environment variables to export by hand." },
        { "caption": "Airlock reads what you asked for last time.",
          "detail": "provider-policy.json holds your intent. It is deliberately separate from what is running right now, so a crashed session can never look like a changed preference." },
        { "caption": "It checks whether the faster backend is even possible on this machine.",
          "detail": "vLLM needs an NVIDIA GPU and Docker running. If either is missing you are never offered it — no failed launch, no confusing error." },
        { "caption": "It picks a model that fits your graphics card.",
          "detail": "Sized against free VRAM, not free system RAM. A model that spills onto the CPU technically runs, but each turn takes minutes — which for an interactive loop is the same as broken." },
        { "caption": "One backend starts. Exactly one, always.",
          "detail": "Any stray instance from an earlier session is found and stopped first, so two copies never fight over the same GPU memory." },
        { "caption": "A firewall rule blocks the port from the outside.",
          "detail": "Belt and braces — the listener is already bound to loopback only, so nothing off your machine could reach it either way." },
        { "caption": "You get one stable address: 127.0.0.1:12345.",
          "detail": "Swap the model, swap the backend, and this address does not change. Nothing you configured yesterday breaks today." },
        { "caption": "Every step of that is written to an audit log.",
          "detail": "Which model, which backend, when, and whether it succeeded. This scene can be regenerated from that log." },
        { "caption": "Now point any AI tool at it and start working.",
          "detail": "For Claude Code, run ai-claude-on — it redirects this shell only, checks the port is alive first, and ai-claude-off puts it back." }
      ]
    },
    {
      "name": "A request, once you're running",
      "mode": "auto",
      "loop": true,
      "speed": 3,
      "path": ["tools", "endpoint", "audit"]
    }
  ]
}
